{
  "protocolVersion": 1,
  "roundId": "round-demo-001",
  "ts": "2026-06-02T12:10:00Z",
  "eventId": 10,
  "sequence": 10,
  "type": "awaiting_skip",
  "author": {
    "id": "system",
    "name": "Pi Roundtable",
    "mbti": "N/A",
    "role": "system",
    "colorSeed": "system"
  },
  "payload": {
    "personaId": "persona-turing",
    "providerId": "backup-gateway",
    "model": "pi-agent-beta-fallback",
    "attempt": 3,
    "reason": "all configured models unavailable",
    "skipCommand": "skip"
  },
  "turnId": "turn-turing-001"
}
