{
  "protocolVersion": 1,
  "roundId": "round-demo-001",
  "ts": "2026-06-02T12:11:00Z",
  "eventId": 11,
  "sequence": 11,
  "type": "round_end",
  "author": {
    "id": "moderator-main",
    "name": "Moderator",
    "mbti": "ENFJ",
    "role": "moderator",
    "colorSeed": "moderator-main"
  },
  "payload": {
    "reason": "stopped",
    "finalSummaryMarkdown": "Stopped by user after synthesis.",
    "endedByCommandId": "cmd-stop-001",
    "turnCount": 2
  },
  "turnId": null
}
